{
  "$schema": "./schemas/knowledge-graph.schema.json",
  "version": 1,
  "generated_at": "2026-07-25",
  "counts": {
    "adr": 73,
    "audit": 14,
    "hard-rule": 26,
    "initiative": 6,
    "playbook": 60,
    "pr": 148,
    "skill": 23
  },
  "nodes": [
    {
      "id": "adr:0001",
      "type": "adr",
      "title": "ADR-0001: Monetization architecture (16 рішень перед стартом)",
      "path": "docs/04-governance/adr/0001-monetization-architecture.md",
      "status": "Accepted",
      "tier": "core",
      "meta": {
        "number": 1
      }
    },
    {
      "id": "adr:0002",
      "type": "adr",
      "title": "ADR-0002: AI tool lifecycle (proposal → safety review → rollout → KPIs)",
      "path": "docs/04-governance/adr/0002-tool-lifecycle.md",
      "status": "accepted",
      "tier": "core",
      "meta": {
        "number": 2
      }
    },
    {
      "id": "adr:0003",
      "type": "adr",
      "title": "ADR-0003: Refund and dispute handling",
      "path": "docs/04-governance/adr/0003-refund-and-dispute-handling.md",
      "status": "proposed",
      "tier": "core",
      "meta": {
        "number": 3
      }
    },
    {
      "id": "adr:0004",
      "type": "adr",
      "title": "ADR-0004: CloudSync — LWW conflict resolution",
      "path": "docs/04-governance/adr/0004-cloudsync-lww-conflict-resolution.md",
      "status": "superseded by [ADR-0047](./0047-cloudsync-v1-410-gone.md) (CloudSync v1 → 410 Gone, T₀ executed 2026-05-06)",
      "tier": "core",
      "meta": {
        "number": 4
      }
    },
    {
      "id": "adr:0005",
      "type": "adr",
      "title": "ADR-0005: Anthropic model selection + prompt caching",
      "path": "docs/04-governance/adr/0005-anthropic-model-selection-and-prompt-caching.md",
      "status": "accepted",
      "tier": "core",
      "meta": {
        "number": 5
      }
    },
    {
      "id": "adr:0006",
      "type": "adr",
      "title": "ADR-0006: React Query keys via centralized factory (no inline tuples)",
      "path": "docs/04-governance/adr/0006-rq-keys-factory.md",
      "status": "accepted",
      "tier": "core",
      "meta": {
        "number": 6
      }
    },
    {
      "id": "adr:0007",
      "type": "adr",
      "title": "ADR-0007: Tailwind colour-opacity scale + WCAG-AA `-strong` tier",
      "path": "docs/04-governance/adr/0007-tailwind-opacity-and-strong-tier.md",
      "status": "accepted",
      "tier": "core",
      "meta": {
        "number": 7
      }
    },
    {
      "id": "adr:0008",
      "type": "adr",
      "title": "ADR-0008: Feature flags — client-only registry over typedStore",
      "path": "docs/04-governance/adr/0008-feature-flags.md",
      "status": "accepted",
      "tier": "core",
      "meta": {
        "number": 8
      }
    },
    {
      "id": "adr:0009",
      "type": "adr",
      "title": "ADR-0009: Hosting split — Railway (API + Postgres) + Vercel (web)",
      "path": "docs/04-governance/adr/0009-hosting-split-railway-vercel.md",
      "status": "superseded by ADR-0074 (backend-частина; Vercel + edge-proxy топологія збережена)",
      "tier": "core",
      "meta": {
        "number": 9
      }
    },
    {
      "id": "adr:0010",
      "type": "adr",
      "title": "ADR-0010: Mobile dual-track — Capacitor shell + Expo native",
      "path": "docs/04-governance/adr/0010-mobile-dual-track-capacitor-expo.md",
      "status": "Superseded by ADR-0052",
      "tier": "core",
      "meta": {
        "number": 10
      }
    },
    {
      "id": "adr:0011",
      "type": "adr",
      "title": "ADR-0011: Local-first storage — клієнт як джерело істини, сервер як LWW-реплікатор",
      "path": "docs/04-governance/adr/0011-local-first-storage.md",
      "status": "Active",
      "tier": "core",
      "meta": {
        "number": 11,
        "last_validated": "2026-07-21"
      }
    },
    {
      "id": "adr:0012",
      "type": "adr",
      "title": "ADR-0012: RLS як authz boundary — цільова модель, наразі app-enforced",
      "path": "docs/04-governance/adr/0012-rls-as-authz-boundary.md",
      "status": "proposed",
      "tier": "core",
      "meta": {
        "number": 12
      }
    },
    {
      "id": "adr:0013",
      "type": "adr",
      "title": "ADR-0013: DB migrations conventions — sequential, forward-only, two-phase DROP",
      "path": "docs/04-governance/adr/0013-db-migrations-conventions.md",
      "status": "accepted",
      "tier": "core",
      "meta": {
        "number": 13
      }
    },
    {
      "id": "adr:0014",
      "type": "adr",
      "title": "ADR-0014: `bigint` → `number` coercion у API-серіалізаторах",
      "path": "docs/04-governance/adr/0014-bigint-to-number-policy.md",
      "status": "accepted",
      "tier": "core",
      "meta": {
        "number": 14
      }
    },
    {
      "id": "adr:0015",
      "type": "adr",
      "title": "ADR-0015: Observability stack — Pino + Prometheus + Sentry",
      "path": "docs/04-governance/adr/0015-observability-stack.md",
      "status": "accepted",
      "tier": "core",
      "meta": {
        "number": 15
      }
    },
    {
      "id": "adr:0016",
      "type": "adr",
      "title": "ADR-0016: User deletion and PII handling",
      "path": "docs/04-governance/adr/0016-user-deletion-and-pii-handling.md",
      "status": "proposed",
      "tier": "core",
      "meta": {
        "number": 16
      }
    },
    {
      "id": "adr:0017",
      "type": "adr",
      "title": "ADR-0017: Better Auth choice and session model",
      "path": "docs/04-governance/adr/0017-better-auth-choice-and-session-model.md",
      "status": "accepted",
      "tier": "core",
      "meta": {
        "number": 17
      }
    },
    {
      "id": "adr:0018",
      "type": "adr",
      "title": "ADR-0018: API versioning policy (`/api/v1`)",
      "path": "docs/04-governance/adr/0018-api-versioning-policy.md",
      "status": "Superseded by [ADR-0053](./0053-api-versioning-policy.md)",
      "tier": "core",
      "meta": {
        "number": 18
      }
    },
    {
      "id": "adr:0019",
      "type": "adr",
      "title": "ADR-0019: Push notifications — server-driven fan-out (web + APNs + FCM)",
      "path": "docs/04-governance/adr/0019-push-notifications.md",
      "status": "accepted",
      "tier": "core",
      "meta": {
        "number": 19
      }
    },
    {
      "id": "adr:0020",
      "type": "adr",
      "title": "ADR-0020: Testing pyramid — unit / integration / a11y / smoke-e2e",
      "path": "docs/04-governance/adr/0020-testing-pyramid.md",
      "status": "accepted",
      "tier": "core",
      "meta": {
        "number": 20
      }
    },
    {
      "id": "adr:0021",
      "type": "adr",
      "title": "ADR-0021: Memory Bank — local-first AI user-fact store",
      "path": "docs/04-governance/adr/0021-memory-bank.md",
      "status": "accepted",
      "tier": "core",
      "meta": {
        "number": 21
      }
    },
    {
      "id": "adr:0022",
      "type": "adr",
      "title": "ADR-0022: Atomic SQL daily quotas — `INSERT ... ON CONFLICT DO UPDATE WHERE`",
      "path": "docs/04-governance/adr/0022-atomic-sql-quotas.md",
      "status": "accepted",
      "tier": "core",
      "meta": {
        "number": 22
      }
    },
    {
      "id": "adr:0023",
      "type": "adr",
      "title": "ADR-0023: Turborepo as monorepo task runner",
      "path": "docs/04-governance/adr/0023-turbo-monorepo-runner.md",
      "status": "accepted",
      "tier": "core",
      "meta": {
        "number": 23
      }
    },
    {
      "id": "adr:0024",
      "type": "adr",
      "title": "ADR-0024: Monorepo split — `apps/*` (deployables) + `packages/*` (libraries)",
      "path": "docs/04-governance/adr/0024-monorepo-apps-packages-split.md",
      "status": "accepted",
      "tier": "core",
      "meta": {
        "number": 24
      }
    },
    {
      "id": "adr:0025",
      "type": "adr",
      "title": "ADR-0025: OpenAPI 3.1 spec — generated from canonical zod-schemas",
      "path": "docs/04-governance/adr/0025-openapi-generation.md",
      "status": "accepted",
      "tier": "core",
      "meta": {
        "number": 25
      }
    },
    {
      "id": "adr:0026",
      "type": "adr",
      "title": "ADR-0026: n8n — джерело істини для воркфлоу",
      "path": "docs/04-governance/adr/0026-n8n-workflow-source-of-truth.md",
      "tier": "core",
      "meta": {
        "number": 26
      }
    },
    {
      "id": "adr:0027",
      "type": "adr",
      "title": "ADR-0027: політика OpenClaw, Console та MCP",
      "path": "docs/04-governance/adr/0027-openclaw-console-mcp-policy.md",
      "tier": "core",
      "meta": {
        "number": 27
      }
    },
    {
      "id": "adr:0028",
      "type": "adr",
      "title": "ADR-0028: pgvector + Voyage embeddings for AI semantic memory",
      "path": "docs/04-governance/adr/0028-pgvector-ai-memory.md",
      "status": "Accepted",
      "tier": "core",
      "meta": {
        "number": 28
      }
    },
    {
      "id": "adr:0030",
      "type": "adr",
      "title": "ADR-0030: Структура Telegram-каналів для n8n reporting",
      "path": "docs/04-governance/adr/0030-telegram-reporting-channel-structure.md",
      "status": "Accepted",
      "tier": "core",
      "meta": {
        "number": 30
      }
    },
    {
      "id": "adr:0031",
      "type": "adr",
      "title": "ADR-0031: OpenClaw v0 — Telegram-only co-founder bot",
      "path": "docs/04-governance/adr/0031-openclaw-v0-telegram-cofounder.md",
      "status": "Superseded by [ADR-0055](./0055-openclaw-external-gateway.md)",
      "tier": "core",
      "meta": {
        "number": 31
      }
    },
    {
      "id": "adr:0032",
      "type": "adr",
      "title": "ADR-0032: Sergeant Console зливається в OpenClaw bot",
      "path": "docs/04-governance/adr/0032-console-consolidated-into-openclaw.md",
      "status": "Superseded by [ADR-0075](./0075-openclaw-gateway-decommissioned.md) (2026-07-20)",
      "tier": "core",
      "meta": {